{
  "bibliography": {
    "access_date": "2026-06-15",
    "lang": "fr",
    "publisher": "Gouvernement français",
    "reliability_note": "Historical minister appointments",
    "reliability_tier": "A",
    "title": "Ministres français historiques",
    "type": "Online_Database_Entry",
    "url": "https://www.gouvernement.fr/"
  },
  "contributions": [],
  "import_batches": [
    {
      "batch_id": "BATCH_SRC_HISTORICAL_MINISTERS",
      "error_count": 0,
      "imported_at": "2026-06-15 02:00:00+02",
      "mapping_version": "v3-task8",
      "row_count": 1301,
      "source_file": "D:/pythonProject_stage/Cleandata_new/source/liste-alphabetique-ministres-de-la-liberation-a-la-veme-republique.xls",
      "status": "loaded",
      "success_count": 1301
    }
  ],
  "metadata": {
    "extensions": {},
    "extracted_by": "data_registry",
    "extraction_date": "2026-06-15",
    "source_file": "Cleandata_new/source/liste-alphabetique-ministres-de-la-liberation-a-la-veme-republique.xls",
    "source_system": "HISTORICAL_MINISTER"
  },
  "record_version": 1,
  "schema_version": "3.0",
  "source_id": "SRC_HISTORICAL_MINISTERS"
}
